[{"id":"crystal-johto-kanto","image":"games/crystal/maps/WORLD_JOHTO_KANTO.png","width":12000,"height":4752,"maps":[{"id":"MAP_NEW_BARK_TOWN","x":5600,"y":3888,"width":320,"height":288,"markerOffsetX":0,"markerOffsetY":0},{"id":"MAP_ROUTE_29","x":4640,"y":3888,"width":960,"height":288,"markerOffsetX":0,"markerOffsetY":0},{"id":"MAP_ROUTE_27","x":5920,"y":3888,"width":1280,"height":288,"markerOffsetX":0,"markerOffsetY":0},{"id":"MAP_ROUTE_46","x":4960,"y":3312,"width":320,"height":576,"markerOffsetX":0,"markerOffsetY":0},{"id":"MAP_CHERRYGROVE_CITY","x":4000,"y":3888,"width":640,"height":288,"markerOffsetX":0,"markerOffsetY":0},{"id":"MAP_ROUTE_26","x":7200,"y":2448,"width":320,"height":1728,"markerOffsetX":0,"markerOffsetY":0},{"id":"MAP_ROUTE_45","x":5280,"y":2160,"width":320,"height":1440,"markerOffsetX":0,"markerOffsetY":0},{"id":"MAP_ROUTE_30","x":4160,"y":3024,"width":320,"height":864,"markerOffsetX":0,"markerOffsetY":0},{"id":"MAP_BLACKTHORN_CITY","x":5280,"y":1584,"width":640,"height":576,"markerOffsetX":0,"markerOffsetY":0},{"id":"MAP_ROUTE_31","x":3840,"y":2736,"width":640,"height":288,"markerOffsetX":0,"markerOffsetY":0},{"id":"MAP_ROUTE_44","x":4320,"y":1872,"width":960,"height":288,"markerOffsetX":0,"markerOffsetY":0},{"id":"MAP_VIOLET_CITY","x":3200,"y":2448,"width":640,"height":576,"markerOffsetX":0,"markerOffsetY":0},{"id":"MAP_MAHOGANY_TOWN","x":4000,"y":1872,"width":320,"height":288,"markerOffsetX":0,"markerOffsetY":0},{"id":"MAP_ROUTE_32","x":3200,"y":3024,"width":320,"height":1440,"markerOffsetX":0,"markerOffsetY":0},{"id":"MAP_ROUTE_36","x":2240,"y":2448,"width":960,"height":288,"markerOffsetX":0,"markerOffsetY":0},{"id":"MAP_ROUTE_43","x":4000,"y":1008,"width":320,"height":864,"markerOffsetX":0,"markerOffsetY":0},{"id":"MAP_ROUTE_42","x":3040,"y":1872,"width":960,"height":288,"markerOffsetX":0,"markerOffsetY":0},{"id":"MAP_ROUTE_33","x":3200,"y":4464,"width":320,"height":288,"markerOffsetX":0,"markerOffsetY":0},{"id":"MAP_ROUTE_37","x":2560,"y":2160,"width":320,"height":288,"markerOffsetX":0,"markerOffsetY":0},{"id":"MAP_ROUTE_35","x":2240,"y":2736,"width":320,"height":576,"markerOffsetX":0,"markerOffsetY":0},{"id":"MAP_LAKE_OF_RAGE","x":3840,"y":432,"width":640,"height":576,"markerOffsetX":0,"markerOffsetY":0},{"id":"MAP_ECRUTEAK_CITY","x":2400,"y":1584,"width":640,"height":576,"markerOffsetX":0,"markerOffsetY":0},{"id":"MAP_AZALEA_TOWN","x":2560,"y":4464,"width":640,"height":288,"markerOffsetX":0,"markerOffsetY":0},{"id":"MAP_GOLDENROD_CITY","x":2080,"y":3312,"width":640,"height":576,"markerOffsetX":0,"markerOffsetY":0},{"id":"MAP_ROUTE_38","x":1760,"y":1744,"width":640,"height":288,"markerOffsetX":0,"markerOffsetY":0},{"id":"MAP_ROUTE_34","x":2240,"y":3888,"width":320,"height":864,"markerOffsetX":0,"markerOffsetY":0},{"id":"MAP_ROUTE_39","x":1440,"y":1744,"width":320,"height":576,"markerOffsetX":0,"markerOffsetY":0},{"id":"MAP_OLIVINE_CITY","x":1280,"y":2320,"width":640,"height":576,"markerOffsetX":0,"markerOffsetY":0},{"id":"MAP_ROUTE_40","x":960,"y":2608,"width":320,"height":576,"markerOffsetX":0,"markerOffsetY":0},{"id":"MAP_ROUTE_41","x":480,"y":3184,"width":800,"height":864,"markerOffsetX":0,"markerOffsetY":0},{"id":"MAP_CIANWOOD_CITY","x":0,"y":3184,"width":480,"height":864,"markerOffsetX":0,"markerOffsetY":0},{"id":"MAP_PALLET_TOWN","x":8480,"y":3168,"width":320,"height":288,"markerOffsetX":0,"markerOffsetY":0},{"id":"MAP_ROUTE_1","x":8480,"y":2592,"width":320,"height":576,"markerOffsetX":0,"markerOffsetY":0},{"id":"MAP_ROUTE_21","x":8480,"y":3456,"width":320,"height":576,"markerOffsetX":0,"markerOffsetY":0},{"id":"MAP_VIRIDIAN_CITY","x":8160,"y":2016,"width":640,"height":576,"markerOffsetX":0,"markerOffsetY":0},{"id":"MAP_CINNABAR_ISLAND","x":8480,"y":4032,"width":320,"height":288,"markerOffsetX":0,"markerOffsetY":0},{"id":"MAP_ROUTE_2","x":8320,"y":1152,"width":320,"height":864,"markerOffsetX":0,"markerOffsetY":0},{"id":"MAP_ROUTE_22","x":7520,"y":2144,"width":640,"height":288,"markerOffsetX":0,"markerOffsetY":0},{"id":"MAP_ROUTE_20","x":8800,"y":4032,"width":960,"height":288,"markerOffsetX":0,"markerOffsetY":0},{"id":"MAP_PEWTER_CITY","x":8160,"y":576,"width":640,"height":576,"markerOffsetX":0,"markerOffsetY":0},{"id":"MAP_ROUTE_19","x":9760,"y":3744,"width":320,"height":576,"markerOffsetX":0,"markerOffsetY":0},{"id":"MAP_ROUTE_3","x":8800,"y":736,"width":960,"height":288,"markerOffsetX":0,"markerOffsetY":0},{"id":"MAP_FUCHSIA_CITY","x":9760,"y":3168,"width":640,"height":576,"markerOffsetX":0,"markerOffsetY":0},{"id":"MAP_ROUTE_4","x":9760,"y":736,"width":640,"height":288,"markerOffsetX":0,"markerOffsetY":0},{"id":"MAP_ROUTE_18","x":9440,"y":3392,"width":320,"height":288,"markerOffsetX":0,"markerOffsetY":0},{"id":"MAP_ROUTE_15","x":10400,"y":3456,"width":640,"height":288,"markerOffsetX":0,"markerOffsetY":0},{"id":"MAP_CERULEAN_CITY","x":10400,"y":576,"width":640,"height":576,"markerOffsetX":0,"markerOffsetY":0},{"id":"MAP_ROUTE_17","x":9120,"y":2176,"width":320,"height":1440,"markerOffsetX":0,"markerOffsetY":0},{"id":"MAP_ROUTE_14","x":11040,"y":3168,"width":320,"height":576,"markerOffsetX":0,"markerOffsetY":0},{"id":"MAP_ROUTE_24","x":10592,"y":288,"width":320,"height":288,"markerOffsetX":0,"markerOffsetY":0},{"id":"MAP_ROUTE_5","x":10560,"y":1152,"width":320,"height":288,"markerOffsetX":0,"markerOffsetY":0},{"id":"MAP_ROUTE_9","x":11040,"y":864,"width":960,"height":288,"markerOffsetX":0,"markerOffsetY":0},{"id":"MAP_ROUTE_16","x":9120,"y":1888,"width":320,"height":288,"markerOffsetX":0,"markerOffsetY":0},{"id":"MAP_ROUTE_13","x":11040,"y":2880,"width":960,"height":288,"markerOffsetX":0,"markerOffsetY":0},{"id":"MAP_ROUTE_25","x":10592,"y":0,"width":960,"height":288,"markerOffsetX":0,"markerOffsetY":0},{"id":"MAP_SAFFRON_CITY","x":10400,"y":1440,"width":640,"height":576,"markerOffsetX":0,"markerOffsetY":0},{"id":"MAP_ROUTE_10_NORTH","x":11680,"y":1152,"width":320,"height":288,"markerOffsetX":0,"markerOffsetY":0},{"id":"MAP_CELADON_CITY","x":9440,"y":1600,"width":640,"height":576,"markerOffsetX":0,"markerOffsetY":0},{"id":"MAP_ROUTE_12","x":11680,"y":2016,"width":320,"height":864,"markerOffsetX":0,"markerOffsetY":0},{"id":"MAP_ROUTE_6","x":10560,"y":2016,"width":320,"height":288,"markerOffsetX":0,"markerOffsetY":0},{"id":"MAP_ROUTE_7","x":10080,"y":1728,"width":320,"height":288,"markerOffsetX":0,"markerOffsetY":0},{"id":"MAP_ROUTE_8","x":11040,"y":1728,"width":640,"height":288,"markerOffsetX":0,"markerOffsetY":0},{"id":"MAP_ROUTE_10_SOUTH","x":11680,"y":1440,"width":320,"height":288,"markerOffsetX":0,"markerOffsetY":0},{"id":"MAP_LAVENDER_TOWN","x":11680,"y":1728,"width":320,"height":288,"markerOffsetX":0,"markerOffsetY":0},{"id":"MAP_ROUTE_11","x":11040,"y":2304,"width":640,"height":288,"markerOffsetX":0,"markerOffsetY":0},{"id":"MAP_VERMILION_CITY","x":10400,"y":2304,"width":640,"height":576,"markerOffsetX":0,"markerOffsetY":0},{"id":"MAP_ROUTE_28","x":6560,"y":2144,"width":640,"height":288,"markerOffsetX":0,"markerOffsetY":0},{"id":"MAP_SILVER_CAVE_OUTSIDE","x":5920,"y":1856,"width":640,"height":576,"markerOffsetX":0,"markerOffsetY":0},{"id":"MAP_ROUTE_23","x":7200,"y":1840,"width":320,"height":288,"markerOffsetX":0,"markerOffsetY":0},{"id":"MAP_BATTLE_TOWER_OUTSIDE","x":960,"y":2288,"width":320,"height":320,"markerOffsetX":0,"markerOffsetY":0},{"id":"MAP_VICTORY_ROAD_OVERWORLD","x":7200,"y":2128,"width":320,"height":320,"markerOffsetX":0,"markerOffsetY":0}]}]