[{"id":"yellow-kanto","image":"games/yellow/maps/WORLD_KANTO.png","width":5440,"height":5760,"maps":[{"id":"MAP_PALLET_TOWN","x":800,"y":3744,"width":320,"height":288},{"id":"MAP_ROUTE_1","x":800,"y":3168,"width":320,"height":576},{"id":"MAP_ROUTE_21","x":800,"y":4032,"width":320,"height":1440},{"id":"MAP_VIRIDIAN_CITY","x":640,"y":2592,"width":640,"height":576},{"id":"MAP_CINNABAR_ISLAND","x":800,"y":5472,"width":320,"height":288},{"id":"MAP_ROUTE_2","x":800,"y":1440,"width":320,"height":1152},{"id":"MAP_ROUTE_22","x":0,"y":2720,"width":640,"height":288},{"id":"MAP_ROUTE_20","x":1120,"y":5472,"width":1600,"height":288},{"id":"MAP_PEWTER_CITY","x":640,"y":864,"width":640,"height":576},{"id":"MAP_ROUTE_23","x":0,"y":416,"width":320,"height":2304},{"id":"MAP_ROUTE_19","x":2720,"y":4896,"width":320,"height":864},{"id":"MAP_ROUTE_3","x":1280,"y":992,"width":1120,"height":288},{"id":"MAP_INDIGO_PLATEAU","x":0,"y":128,"width":320,"height":288},{"id":"MAP_FUCHSIA_CITY","x":2560,"y":4320,"width":640,"height":576},{"id":"MAP_ROUTE_4","x":2080,"y":704,"width":1440,"height":288},{"id":"MAP_ROUTE_18","x":1760,"y":4448,"width":800,"height":288},{"id":"MAP_ROUTE_15","x":3200,"y":4448,"width":960,"height":288},{"id":"MAP_CERULEAN_CITY","x":3520,"y":576,"width":640,"height":576},{"id":"MAP_ROUTE_17","x":1760,"y":2144,"width":320,"height":2304},{"id":"MAP_ROUTE_14","x":4160,"y":3872,"width":320,"height":864},{"id":"MAP_ROUTE_24","x":3680,"y":0,"width":320,"height":576},{"id":"MAP_ROUTE_5","x":3680,"y":1152,"width":320,"height":576},{"id":"MAP_ROUTE_9","x":4160,"y":704,"width":960,"height":288},{"id":"MAP_ROUTE_16","x":1760,"y":1856,"width":640,"height":288},{"id":"MAP_ROUTE_13","x":4480,"y":3872,"width":960,"height":288},{"id":"MAP_ROUTE_25","x":4000,"y":0,"width":960,"height":288},{"id":"MAP_SAFFRON_CITY","x":3520,"y":1728,"width":640,"height":576},{"id":"MAP_ROUTE_10","x":5120,"y":704,"width":320,"height":1152},{"id":"MAP_CELADON_CITY","x":2400,"y":1728,"width":800,"height":576},{"id":"MAP_ROUTE_12","x":5120,"y":2144,"width":320,"height":1728},{"id":"MAP_ROUTE_6","x":3680,"y":2304,"width":320,"height":576},{"id":"MAP_ROUTE_7","x":3200,"y":1856,"width":320,"height":288},{"id":"MAP_ROUTE_8","x":4160,"y":1856,"width":960,"height":288},{"id":"MAP_LAVENDER_TOWN","x":5120,"y":1856,"width":320,"height":288},{"id":"MAP_ROUTE_11","x":4160,"y":3008,"width":960,"height":288},{"id":"MAP_VERMILION_CITY","x":3520,"y":2880,"width":640,"height":576}]}]