[{"id":"rs-hoenn","name":"Hoenn","image":"games/rs/maps/WORLD_RS_HOENN.png","width":12800,"height":6080,"maps":[{"id":"MAP_LITTLEROOT_TOWN","x":1920,"y":4480,"width":320,"height":320},{"id":"MAP_ROUTE101","x":1920,"y":4160,"width":320,"height":320},{"id":"MAP_OLDALE_TOWN","x":1920,"y":3840,"width":320,"height":320},{"id":"MAP_ROUTE103","x":1920,"y":3520,"width":1280,"height":320},{"id":"MAP_ROUTE102","x":1120,"y":3840,"width":800,"height":320},{"id":"MAP_ROUTE110","x":3200,"y":2560,"width":640,"height":1600},{"id":"MAP_PETALBURG_CITY","x":640,"y":3680,"width":480,"height":480},{"id":"MAP_MAUVILLE_CITY","x":3200,"y":2240,"width":640,"height":320},{"id":"MAP_SLATEPORT_CITY","x":3200,"y":4160,"width":640,"height":960},{"id":"MAP_ROUTE104","x":0,"y":2880,"width":640,"height":1280},{"id":"MAP_ROUTE111","x":3200,"y":0,"width":640,"height":2240},{"id":"MAP_ROUTE117","x":2240,"y":2240,"width":960,"height":320},{"id":"MAP_ROUTE118","x":3840,"y":2240,"width":1280,"height":320},{"id":"MAP_ROUTE109","x":3200,"y":5120,"width":640,"height":960},{"id":"MAP_ROUTE134","x":3840,"y":4160,"width":1280,"height":640},{"id":"MAP_RUSTBORO_CITY","x":0,"y":1920,"width":640,"height":960},{"id":"MAP_ROUTE105","x":0,"y":4160,"width":640,"height":1280},{"id":"MAP_ROUTE113","x":1600,"y":0,"width":1600,"height":320},{"id":"MAP_ROUTE112","x":2560,"y":320,"width":640,"height":960},{"id":"MAP_VERDANTURF_TOWN","x":1920,"y":2240,"width":320,"height":320},{"id":"MAP_ROUTE119","x":4480,"y":0,"width":640,"height":2240},{"id":"MAP_ROUTE123","x":5120,"y":2240,"width":2240,"height":320},{"id":"MAP_ROUTE108","x":2240,"y":5760,"width":960,"height":320},{"id":"MAP_ROUTE133","x":5120,"y":4160,"width":1280,"height":640},{"id":"MAP_ROUTE115","x":0,"y":640,"width":640,"height":1280},{"id":"MAP_ROUTE116","x":640,"y":1920,"width":1600,"height":320},{"id":"MAP_ROUTE106","x":0,"y":5440,"width":1280,"height":320},{"id":"MAP_FALLARBOR_TOWN","x":1280,"y":0,"width":320,"height":320},{"id":"MAP_LAVARIDGE_TOWN","x":2240,"y":960,"width":320,"height":320},{"id":"MAP_FORTREE_CITY","x":5120,"y":0,"width":640,"height":320},{"id":"MAP_ROUTE122","x":6720,"y":1600,"width":640,"height":640},{"id":"MAP_ROUTE107","x":1280,"y":5760,"width":960,"height":320},{"id":"MAP_ROUTE132","x":6400,"y":4160,"width":1280,"height":640},{"id":"MAP_ROUTE114","x":640,"y":0,"width":640,"height":1280},{"id":"MAP_DEWFORD_TOWN","x":960,"y":5760,"width":320,"height":320},{"id":"MAP_ROUTE120","x":5760,"y":0,"width":640,"height":1600},{"id":"MAP_ROUTE121","x":6400,"y":1280,"width":1280,"height":320},{"id":"MAP_PACIFIDLOG_TOWN","x":7680,"y":4160,"width":320,"height":640},{"id":"MAP_LILYCOVE_CITY","x":7680,"y":1120,"width":1280,"height":640},{"id":"MAP_ROUTE131","x":8000,"y":4160,"width":960,"height":640},{"id":"MAP_ROUTE124","x":8960,"y":960,"width":1280,"height":1280},{"id":"MAP_ROUTE130","x":8960,"y":4160,"width":1280,"height":640},{"id":"MAP_ROUTE126","x":8960,"y":2240,"width":1280,"height":1280},{"id":"MAP_ROUTE125","x":10240,"y":960,"width":1280,"height":640},{"id":"MAP_MOSSDEEP_CITY","x":10240,"y":1600,"width":1280,"height":640},{"id":"MAP_ROUTE129","x":10240,"y":4160,"width":1280,"height":640},{"id":"MAP_ROUTE127","x":10240,"y":2240,"width":1280,"height":1280},{"id":"MAP_ROUTE128","x":10240,"y":3520,"width":1920,"height":640},{"id":"MAP_EVER_GRANDE_CITY","x":12160,"y":2880,"width":640,"height":1280}]},{"id":"rs-underwater","name":"Underwater","image":"games/rs/maps/WORLD_RS_UNDERWATER.png","width":3200,"height":3200,"maps":[{"id":"MAP_UNDERWATER1","x":0,"y":0,"width":1280,"height":1280},{"id":"MAP_UNDERWATER2","x":0,"y":1280,"width":1280,"height":1280},{"id":"MAP_UNDERWATER3","x":1280,"y":1280,"width":1280,"height":1280},{"id":"MAP_UNDERWATER4","x":1280,"y":2560,"width":1920,"height":640}]},{"id":"rs-battle-tower","name":"Battle Tower","image":"games/rs/maps/WORLD_RS_BATTLE_TOWER.png","width":464,"height":480,"maps":[{"id":"MAP_BATTLE_TOWER_OUTSIDE","x":0,"y":0,"width":464,"height":480}]}]