[{"id":"kanto","image":"games/frlg/maps/WORLD_KANTO.png","width":6528,"height":6400,"maps":[{"id":"MAP_PALLET_TOWN","x":960,"y":4160,"width":384,"height":320},{"id":"MAP_ROUTE1","x":960,"y":3520,"width":384,"height":640},{"id":"MAP_ROUTE21_NORTH","x":960,"y":4480,"width":384,"height":800},{"id":"MAP_VIRIDIAN_CITY","x":768,"y":2880,"width":768,"height":640},{"id":"MAP_ROUTE21_SOUTH","x":960,"y":5280,"width":384,"height":800},{"id":"MAP_ROUTE2","x":960,"y":1600,"width":384,"height":1280},{"id":"MAP_ROUTE22","x":0,"y":3040,"width":768,"height":384},{"id":"MAP_CINNABAR_ISLAND","x":960,"y":6080,"width":384,"height":320},{"id":"MAP_PEWTER_CITY","x":768,"y":960,"width":768,"height":640},{"id":"MAP_ROUTE23","x":0,"y":480,"width":384,"height":2560},{"id":"MAP_ROUTE20","x":1344,"y":6080,"width":1920,"height":320},{"id":"MAP_ROUTE3","x":1536,"y":1120,"width":1344,"height":320},{"id":"MAP_INDIGO_PLATEAU_EXTERIOR","x":0,"y":160,"width":384,"height":320},{"id":"MAP_ROUTE19","x":3264,"y":5440,"width":384,"height":960},{"id":"MAP_ROUTE4","x":2496,"y":800,"width":1728,"height":320},{"id":"MAP_FUCHSIA_CITY","x":3072,"y":4800,"width":768,"height":640},{"id":"MAP_CERULEAN_CITY","x":4224,"y":640,"width":768,"height":640},{"id":"MAP_ROUTE18","x":2112,"y":4960,"width":960,"height":320},{"id":"MAP_ROUTE15","x":3840,"y":4960,"width":1152,"height":320},{"id":"MAP_ROUTE24","x":4416,"y":0,"width":384,"height":640},{"id":"MAP_ROUTE5","x":4224,"y":1280,"width":768,"height":640},{"id":"MAP_ROUTE9","x":4992,"y":800,"width":1152,"height":320},{"id":"MAP_ROUTE17","x":2112,"y":2400,"width":384,"height":2560},{"id":"MAP_ROUTE14","x":4992,"y":4320,"width":384,"height":960},{"id":"MAP_ROUTE25","x":4800,"y":0,"width":1152,"height":320},{"id":"MAP_SAFFRON_CITY","x":4224,"y":1920,"width":768,"height":640,"markerOffsetX":10,"markerOffsetY":7},{"id":"MAP_ROUTE10","x":6144,"y":800,"width":384,"height":1280},{"id":"MAP_ROUTE16","x":2112,"y":2080,"width":768,"height":320},{"id":"MAP_ROUTE13","x":5376,"y":4320,"width":1152,"height":320},{"id":"MAP_ROUTE6","x":4416,"y":2560,"width":384,"height":640},{"id":"MAP_ROUTE7","x":3840,"y":2080,"width":384,"height":320},{"id":"MAP_ROUTE8","x":4992,"y":2080,"width":1152,"height":320},{"id":"MAP_LAVENDER_TOWN","x":6144,"y":2080,"width":384,"height":320},{"id":"MAP_CELADON_CITY","x":2880,"y":1920,"width":960,"height":640},{"id":"MAP_ROUTE12","x":6144,"y":2400,"width":384,"height":1920},{"id":"MAP_VERMILION_CITY","x":4224,"y":3200,"width":768,"height":640},{"id":"MAP_ROUTE11","x":4992,"y":3360,"width":1152,"height":320}]},{"id":"sevii","image":"games/frlg/maps/WORLD_SEVII.png","width":16448,"height":4160,"maps":[{"id":"MAP_ONE_ISLAND","x":0,"y":1920,"width":384,"height":320},{"id":"MAP_ONE_ISLAND_TREASURE_BEACH","x":0,"y":2240,"width":384,"height":640},{"id":"MAP_ONE_ISLAND_KINDLE_ROAD","x":384,"y":0,"width":384,"height":2240},{"id":"MAP_TWO_ISLAND","x":960,"y":1920,"width":768,"height":320},{"id":"MAP_TWO_ISLAND_CAPE_BRINK","x":1344,"y":1280,"width":384,"height":640},{"id":"MAP_THREE_ISLAND","x":3456,"y":1920,"width":384,"height":640},{"id":"MAP_THREE_ISLAND_PORT","x":3456,"y":2560,"width":768,"height":320},{"id":"MAP_THREE_ISLAND_BOND_BRIDGE","x":1920,"y":1920,"width":1536,"height":320},{"id":"MAP_FOUR_ISLAND","x":4416,"y":1920,"width":768,"height":640},{"id":"MAP_FIVE_ISLAND","x":6144,"y":1920,"width":384,"height":320},{"id":"MAP_FIVE_ISLAND_WATER_LABYRINTH","x":5376,"y":1600,"width":1152,"height":320},{"id":"MAP_FIVE_ISLAND_MEADOW","x":6528,"y":1920,"width":384,"height":640},{"id":"MAP_FIVE_ISLAND_RESORT_GORGEOUS","x":6144,"y":1280,"width":1152,"height":320},{"id":"MAP_FIVE_ISLAND_MEMORIAL_PILLAR","x":6912,"y":2240,"width":384,"height":960},{"id":"MAP_SEVEN_ISLAND","x":8256,"y":1920,"width":384,"height":320},{"id":"MAP_SEVEN_ISLAND_TRAINER_TOWER","x":7488,"y":1280,"width":1920,"height":640},{"id":"MAP_SEVEN_ISLAND_SEVAULT_CANYON_ENTRANCE","x":8256,"y":2240,"width":384,"height":640},{"id":"MAP_SEVEN_ISLAND_SEVAULT_CANYON","x":8640,"y":2560,"width":384,"height":1280},{"id":"MAP_SEVEN_ISLAND_TANOBY_RUINS","x":7872,"y":3840,"width":2304,"height":320},{"id":"MAP_SIX_ISLAND","x":11136,"y":1920,"width":384,"height":480},{"id":"MAP_SIX_ISLAND_WATER_PATH","x":11520,"y":1280,"width":384,"height":1600},{"id":"MAP_SIX_ISLAND_GREEN_PATH","x":10368,"y":1280,"width":1152,"height":320},{"id":"MAP_SIX_ISLAND_RUIN_VALLEY","x":10752,"y":2560,"width":768,"height":640},{"id":"MAP_SIX_ISLAND_OUTCAST_ISLAND","x":10368,"y":0,"width":384,"height":1280},{"id":"MAP_THREE_ISLAND_BERRY_FOREST","x":12096,"y":1920,"width":912,"height":752},{"id":"MAP_MT_EMBER_EXTERIOR","x":13200,"y":1920,"width":912,"height":864},{"id":"MAP_SIX_ISLAND_PATTERN_BUSH","x":14304,"y":1920,"width":960,"height":512},{"id":"MAP_BIRTH_ISLAND_EXTERIOR","x":15456,"y":1920,"width":480,"height":480},{"id":"MAP_NAVEL_ROCK_EXTERIOR","x":16128,"y":1920,"width":320,"height":368}]}]